{
  "$schema": "https://json-schema.org/draft/2020-12/schema",
  "$id": "https://techfleetworks.github.io/skills-and-practices-framework/schema/framework-data/project-phases.schema.json",
  "title": "project-phases",
  "description": "A record in the project-phases dataset of the Skills & Practices Framework. Field names are the framework's own; see schema/context.jsonld for the schema.org / SKOS mapping.",
  "type": "object",
  "required": [
    "slug"
  ],
  "additionalProperties": false,
  "properties": {
    "id": {
      "type": "integer"
    },
    "slug": {
      "type": "string"
    },
    "Name": {
      "type": "string"
    },
    "New Milestones In This Phase": {
      "type": "array",
      "items": {
        "type": "object",
        "properties": {
          "slug": {
            "type": "string"
          },
          "label": {
            "type": "string"
          }
        },
        "required": [
          "slug",
          "label"
        ],
        "additionalProperties": false
      }
    },
    "New Deliverables In This Phase": {
      "type": "array",
      "items": {
        "type": "object",
        "properties": {
          "slug": {
            "type": "string"
          },
          "label": {
            "type": "string"
          }
        },
        "required": [
          "slug",
          "label"
        ],
        "additionalProperties": false
      }
    },
    "Description": {
      "type": "string"
    },
    "Continued Milestones In This Phase": {
      "type": "array",
      "items": {
        "type": "object",
        "properties": {
          "slug": {
            "type": "string"
          },
          "label": {
            "type": "string"
          }
        },
        "required": [
          "slug",
          "label"
        ],
        "additionalProperties": false
      }
    },
    "Continued Deliverables In This Phase": {
      "type": "array",
      "items": {
        "type": "object",
        "properties": {
          "slug": {
            "type": "string"
          },
          "label": {
            "type": "string"
          }
        },
        "required": [
          "slug",
          "label"
        ],
        "additionalProperties": false
      }
    }
  }
}